koersen,exchange rates,De koersen zijn goed,The exchange rates are good
Brugge,Bruges,Brugge is een stad,Bruges is a city
vrijheid,freedom,De vrijheid is goed,The freedom is good
waaronder,among,Waaronder zijn mensen,Among them are people
individuele,individual,De individuele situatie,The individual situation
bepalen,determine,We bepalen het,We determine it
behoorlijk,considerable,Het is behoorlijk goed,It is considerable
marketing,marketing,De marketing is goed,The marketing is good
Heel,Very,Heel is het goed,Very it is good
belasting,tax,De belasting is goed,The tax is good
veertig,forty,Er zijn veertig kinderen,There are forty children
reclame,advertisement,De reclame is goed,The advertisement is good