kracht,power,De kracht is goed,The power is good
crisis,crisis,De crisis is goed,The crisis is good
heet,hot,Het is heet,It is hot
wist,knew,Hij wist het,He knew it
ton,ton,De ton is goed,The ton is good
inmiddels,by now,Inmiddels is het goed,By now it is good
leidt,leads,Het leidt tot het goed,It leads to the good
kilometer,kilometer,De kilometer is lang,The kilometer is long
ogenblik,moment,Het ogenblik is goed,The moment is good
volgend,next,Het volgende jaar,The next year
portefeuille,portfolio,De portefeuille is goed,The portfolio is good
hard,hard,Het is hard,It is hard
top,top,De top is goed,The top is good
gevonden,found,Het is gevonden,It is found
tekst,text,De tekst is goed,The text is good
Eén,One,Eén man is daar,One man is there
veranderen,change,We veranderen het,We change it
vrije,freedom,De vrije tijd,The free time
investeringen,investments,De investeringen zijn goed,The investments are good
maatregelen,measures,De maatregelen zijn goed,The measures are good
ieder,every,Ieder man is daar,Every man is there
juiste,right,Het juiste antwoord,The right answer
vertrouwen,trust,Het vertrouwen is goed,The trust is good
honderd,hundred,Er zijn honderd kinderen,There are a hundred children
tentoonstelling,exhibition,De tentoonstelling is goed,The exhibition is good
smaak,taste,De smaak is goed,The taste is good
recente,recent,De recente situatie,The recent situation
bracht,brought,Hij bracht het,He brought it
zomer,summer,De zomer is warm,The summer is warm
ontstaan,arise,Het ontstaan is goed,The arising is good
Marc,Marc,Marc is een vriend,Marc is a friend
centrum,center,Het centrum is goed,The center is good
tegelijk,simultaneously,Tegelijk is het goed,Simultaneously it is good
punten,points,De punten zijn goed,The points are good
functie,function,De functie is goed,The function is good
steeg,street,De steeg is schoon,The street is clean
Tweede,Second,De Tweede Kamer,The Second House
traditionele,traditional,De traditionele manier,The traditional way
evolutie,evolution,De evolutie is goed,The evolution is good
stijl,style,De stijl is goed,The style is good
minuten,minutes,De minuten zijn goed,The minutes are good
du,du,Du is een manier van zeggen,Du is a way of saying
Hun,Their,Hun huis is mooi,Their house is beautiful
amper,hardly,Amper is het goed,Hardly it is good
contract,contract,Het contract is goed,The contract is good
lijn,line,De lijn is goed,The line is good
Hier,Here,Hier is het goed,Here it is good
levert,delivers,Het levert goed,It delivers good
mogelijkheid,possibility,De mogelijkheid is goed,The possibility is good
bezit,possess,Het bezit is goed,The possession is good
cultuur,culture,De cultuur is goed,The culture is good
betaalt,pays,Hij betaalt voor het werk,He pays for the work
doel,goal,Het doel is goed,The goal is good
beelden,images,De beelden zijn goed,The images are good
meerderheid,majority,De meerderheid is goed,The majority is good
haalt,brings,Hij haalt het,He brings it
merken,brands,De merken zijn goed,The brands are good
telt,tells,Het telt,It counts
Russische,Russian,De Russische auto,The Russian car
vertelt,tells,Hij vertelt het verhaal,He tells the story
Daarnaast,Furthermore,Daarnaast is het goed,Furthermore it is good
gemeenten,municipalities,De gemeenten zijn goed,The municipalities are good
voelen,feel,We voelen het goed,We feel it good
opleiding,training,De opleiding is goed,The training is good
liever,rather,Liever is het goed,Rather it is good
erin,in,Erin is het goed,In it is good
morgen,tomorrow,Morgen is het goed,Tomorrow it is good
laag,low,De laagste prijs,The lowest price
toont,shows,Het toont het goed,It shows it good
positie,position,De positie is goed,The position is good
praktijk,practice,De praktijk is goed,The practice is good
positief,positive,Het positieve is goed,The positive is good
volledige,complete,De volledige dag,The complete day
witte,white,De witte auto,The white car
lijken,look,Ze lijken op elkaar,They look alike
Amerikanen,Americans,De Amerikanen zijn slim,The Americans are smart
midden,middle,Het midden is goed,The middle is good
sfeer,atmosphere,De sfeer is goed,The atmosphere is good
jaarlijks,yearly,Jaarlijks is het goed,Yearly it is good
bedoeling,intention,De beoeling is goed,The intention is good
foto's,photos,De foto's zijn goed,The photos are good
Zaken,Things,Zaken zijn goed,Things are good
punt,point,Het punt is goed,The point is good
beslissing,decision,De beslissing is goed,The decision is good
hoogte,height,De hoogte is goed,The height is good
Frans,French,De Frans regio,The French region
kabinet,cabinet,Het kabinet is goed,The cabinet is good
betaald,paid,Hij betaald voor het werk,He paid for the work
wagen,vehicle,De wagen is goed,The vehicle is good
belangstelling,interest,De belangstelling is goed,The interest is good
International,International,De International regio,The International region
lucht,air,De lucht is schoon,The air is clean